<?xml version="1.0" encoding="UTF-8"?>
<!DOCTYPE sistema SYSTEM "ejercicio2.dtd">

<sistema>

    <!-- Alumnos -->
    <alumnos>
        <alumno id="alumno1">
            <nombre>María</nombre>
            <tipo>Universitaria</tipo>
        </alumno>

        <alumno id="alumno2">
            <nombre>Pepe</nombre>
            <tipo>Máster</tipo>
        </alumno>
    </alumnos>

    <!-- Personal -->
    <personal>
        <empleado id="empleado1">
            <nombre>Joaquín</nombre>
            <puesto>Bibliotecario</puesto>
        </empleado>
    </personal>

    <!-- Sedes -->
    <sedes>
        <sede id="porvenir">
            <nombre>Porvenir</nombre>
        </sede>

        <sede id="cartuja">
            <nombre>Cartuja</nombre>
        </sede>
    </sedes>

    <!-- Materiales -->
    <materiales>

        <material id="libro1">
            <categoria>Libro</categoria>
            <descripcion>Programación en Java</descripcion>
        </material>

        <material id="libro2">
            <categoria>Libro</categoria>
            <descripcion>Bases de Datos</descripcion>
        </material>

    </materiales>

    <!-- Préstamos -->
    <prestamos>

        <prestamo id="prestamo1">
            <alumno_ref>alumno1</alumno_ref>
            <material_ref>libro1</material_ref>
            <empleado_ref>empleado1</empleado_ref>
            <sede_retiro_ref>porvenir</sede_retiro_ref>
            <sede_devolucion_ref>cartuja</sede_devolucion_ref>
            <fecha_retiro>2026-03-01</fecha_retiro>
            <fecha_devolucion>2026-03-05</fecha_devolucion>
        </prestamo>

    </prestamos>

</sistema>
